{"adapterWorkflowFiles":[{"path":".github/workflows/full-check.yml","sha256":"e6a02a69f0040a908f4e230760b077b9b00308265652af17255e6b9d6448a8b9"}],"dependencyGraph":{"globalRiskPaths":[".github/workflows/**"],"invalidatesWhenChanged":[".ci-coordinator/**",".github/workflows/**"],"nodes":[{"dependents":["tests"],"path":"src","riskClasses":["source"]},{"dependents":[],"path":"tests","riskClasses":["source"]}],"source":"configured"},"executionProfiles":[{"capacityClassId":"hosted-default","credentialProfileId":"no-credentials","executionKind":"native-job-set","fixtureProfileId":"no-fixtures","jobId":"lint","permissionProfileId":"contents-read","profileId":"native-lint","runnerProfileId":"ubuntu-24-04","serviceProfileIds":[],"workflowPath":".github/workflows/full-check.yml"},{"capacityClassId":"hosted-default","credentialProfileId":"no-credentials","executionKind":"native-job-set","fixtureProfileId":"no-fixtures","jobId":"test","permissionProfileId":"contents-read","profileId":"native-test","runnerProfileId":"ubuntu-24-04","serviceProfileIds":[],"workflowPath":".github/workflows/full-check.yml"}],"executionWorkflows":[{"executionJobs":[{"jobId":"lint","needs":["plan"]},{"jobId":"test","needs":["lint","plan"]}],"executionKind":"native-job-set","fallbackJobId":null,"gateJobId":"full-check-gate","gateSignalName":"Full Check","planJobId":"plan","planRequestJobId":"plan-request","planRequestWorkflowRef":"example-org/ci-coordinator/.github/workflows/trusted-plan-request.yml@1111111111111111111111111111111111111111","requiredJobIds":[],"workflowPath":".github/workflows/full-check.yml"}],"generator":{"id":"target-artifacts","version":"1"},"schemaVersion":"dynamic-ci-target-artifacts-source/v1","tests":[]}
