{"adapterWorkflowFiles":[{"path":".github/workflows/ci-coordinator-bootstrap.yml","sha256":"1273739968062fbc9156ef60dc5a0ae287bf15491203bfacbd3058a39fd118de"}],"dependencyGraph":{"globalRiskPaths":[".github/workflows/**","backend/uv.lock"],"invalidatesWhenChanged":[".ci-coordinator/**",".github/workflows/**"],"nodes":[{"dependents":["backend/tests"],"path":"backend/src","riskClasses":["source"]},{"dependents":[],"path":"backend/tests","riskClasses":["dependency","source"]}],"source":"configured"},"executionProfiles":[{"capacityClassId":"self-hosted-default","credentialProfileId":"no-credentials","executionKind":"witness-shards","fixtureProfileId":"no-fixtures","jobId":"selected-python-linux","permissionProfileId":"contents-read","profileId":"python-linux","runnerProfileId":"ubuntu-24-04","serviceProfileIds":[],"workflowPath":".github/workflows/ci-coordinator-bootstrap.yml"},{"capacityClassId":"self-hosted-default","credentialProfileId":"ephemeral-postgres","executionKind":"witness-shards","fixtureProfileId":"postgres-18.6","jobId":"selected-python-postgres","permissionProfileId":"contents-read","profileId":"python-postgres","runnerProfileId":"ubuntu-24-04","serviceProfileIds":["postgres-18.6"],"workflowPath":".github/workflows/ci-coordinator-bootstrap.yml"}],"executionWorkflows":[{"executionJobs":[{"jobId":"selected-python-linux","needs":["plan"]},{"jobId":"selected-python-postgres","needs":["plan"]}],"executionKind":"witness-shards","fallbackJobId":"full-ci","gateJobId":"bootstrap-gate","gateSignalName":"Dynamic CI Bootstrap","planJobId":"plan","planRequestJobId":"plan-request","planRequestWorkflowRef":"example-org/ci-coordinator/.github/workflows/trusted-plan-request.yml@1111111111111111111111111111111111111111","requiredJobIds":[],"workflowPath":".github/workflows/ci-coordinator-bootstrap.yml"}],"generator":{"id":"target-artifacts","version":"1"},"schemaVersion":"dynamic-ci-target-artifacts-source/v1","tests":[{"expectedSeconds":60,"testId":"backend/quality","witnessId":"python-quality"},{"expectedSeconds":90,"testId":"backend/persistence","witnessId":"python-postgres"}]}
